Price,Condominium,FloorSize,NumberOfBedrooms,NumberOfBathrooms,ParkingSpaces,IPTU,Address,Title,Link,Publisher,ItemID,UnitTypes
2500.0,0.0,200.0,2,3,3,16.0,"Rua Vander Rodrigues de Lima, Caiçara Adeláide, Minas Gerais","Casa para Aluguel - Caiçara-Adelaide, 2 Quartos, 200 m2",/imovel/aluguel-casa-2-quartos-caicara-adelaide-belo-horizonte-mg-200m2-id-2555829462/,QUINTO ANDAR SERVICOS IMOBILIARIOS LTDA,2555829462,['HOME']
990.0,0.0,48.0,2,1,1,80.0,"Milionários, Minas Gerais",CASA DE 02 QUARTOS NO MILIONARIOS,/imovel/aluguel-casa-2-quartos-milionarios-belo-horizonte-mg-48m2-id-2557921187/,J DIAS IMOVEIS,2557921187,['HOME']
1300.0,0.0,100.0,3,1,0,80.0,"Rua Caratiá, São Cristóvão, Minas Gerais","Casa residencial para aluguel, 3 quartos, São Cristóvão - Belo Horizonte/MG",/imovel/aluguel-casa-3-quartos-com-cozinha-sao-cristovao-belo-horizonte-mg-100m2-id-2558921922/,ADBENS IMOVEIS,2558921922,['HOME']
1697.0,0.0,70.0,2,2,1,33.0,"Rua Professora Vicentina Barreto, Planalto, Minas Gerais",CASA GEMINADA 02 QUARTOS 01 VAGA DE GARAGEM NO PLANALTO.,/imovel/aluguel-casa-2-quartos-planalto-belo-horizonte-mg-70m2-id-2557906277/,Deltalar Negócios Imobiliários Ltda-ME,2557906277,['HOME']
2675.0,0.0,360.0,3,2,2,274.0,"Rua Marrocos, Canaã, Minas Gerais","Casa 3 quartos, sendo 1 suíte, 02 vagas de garagem, Bairro Canaã - Belo Horizonte",/imovel/aluguel-casa-3-quartos-com-churrasqueira-canaa-belo-horizonte-mg-360m2-id-2558648681/,ARBO IMÓVEIS,2558648681,['HOME']
3000.0,0.0,158.0,3,2,2,172.0,"São Geraldo, Minas Gerais","Casa com 3 dormitórios para alugar, 158 m² por R$ 3.000,00/mês - São Geraldo - Belo Horizonte/MG",/imovel/aluguel-casa-3-quartos-com-cozinha-sao-geraldo-belo-horizonte-mg-158m2-id-2557674984/,Renato Desidério Negócios Imobiliários Ltda,2557674984,['HOME']
1900.0,10.0,130.0,3,1,2,100.0,"Avenida Itaité, São Geraldo, Minas Gerais","Casa para Aluguel - São Geraldo, 3 Quartos, 130 m2",/imovel/aluguel-casa-3-quartos-sao-geraldo-belo-horizonte-mg-130m2-id-2558541336/,QUINTO ANDAR SERVICOS IMOBILIARIOS LTDA,2558541336,['HOME']
1500.0,0.0,120.0,5,2,1,84.0,"Rua Anélio Marques Guimarães, Diamante, Minas Gerais","Casa para aluguel, 5 quartos, 1 vaga, Diamante - Belo Horizonte/MG",/imovel/aluguel-casa-5-quartos-diamante-belo-horizonte-mg-120m2-id-2558526704/,Campos Guimarães Imóveis - Unidade Barreiro,2558526704,['HOME']
4300.0,2000.0,276.0,4,3,3,7532.0,"Lourdes, Minas Gerais","Apartamento para aluguel, 4 quartos, 1 suíte, 3 vagas, Lourdes - Belo Horizonte/MG",/imovel/aluguel-apartamento-4-quartos-com-piscina-lourdes-belo-horizonte-mg-276m2-id-2552064484/,LAR IMÓVEIS LOCAÇÃO,2552064484,['APARTMENT']
4200.0,1100.0,180.0,4,3,4,416.0,"Rua Fidélis Martins, Buritis, Minas Gerais","Apartamento para aluguel, 4 quartos, 2 suítes, 4 vagas, Buritis - Belo Horizonte/MG",/imovel/aluguel-apartamento-4-quartos-com-piscina-buritis-belo-horizonte-mg-180m2-id-2551956079/,SOGNO IMOVEIS ALUGUEL,2551956079,['APARTMENT']
5000.0,1940.0,180.0,4,2,3,1123.0,"Santo Agostinho, Minas Gerais",Aluguel - APARTAMENTO - SANTO AGOSTINHO Belo Horizonte MG,/imovel/aluguel-apartamento-4-quartos-com-piscina-santo-agostinho-belo-horizonte-mg-180m2-id-2558550210/,BEAGA EMPRENDIMENTOS,2558550210,['APARTMENT']
3400.0,400.0,150.0,3,3,2,0.0,"Rua La Plata, Sion, Minas Gerais",Apartamento para aluguel possui 150 metros quadrados com 3 quartos em Sion - Belo Horizonte - MG,/imovel/aluguel-apartamento-3-quartos-sion-belo-horizonte-mg-150m2-id-2559012556/,Grupo Seu Imóvel,2559012556,['APARTMENT']
2000.0,120.0,120.0,3,2,2,116.0,"Rua Izaura, Piratininga Venda Nova, Minas Gerais","Apartamento para Aluguel - Piratininga, 3 Quartos, 120 m2",/imovel/aluguel-apartamento-3-quartos-mobiliado-piratininga-venda-nova-belo-horizonte-mg-120m2-id-2558846727/,QUINTO ANDAR SERVICOS IMOBILIARIOS LTDA,2558846727,['APARTMENT']
2400.0,50.0,110.0,2,2,1,135.0,"Rua Maria Francisca, Boa Vista, Minas Gerais","Apartamento para Aluguel - Boa Vista, 2 Quartos, 110 m2",/imovel/aluguel-apartamento-2-quartos-boa-vista-belo-horizonte-mg-110m2-id-2558636972/,QUINTO ANDAR SERVICOS IMOBILIARIOS LTDA,2558636972,['APARTMENT']
1300.0,489.0,45.0,1,1,1,159.0,"Rua dos Timbiras, Santo Agostinho, Minas Gerais",Apartamento para aluguel com 45 metros quadrados com 1 quarto,/imovel/aluguel-apartamento-1-quarto-santo-agostinho-belo-horizonte-mg-45m2-id-2557706335/,IMOV IMOVEIS,2557706335,['APARTMENT']
2500.0,420.0,110.0,3,2,1,190.0,"Rua Via Láctea, Santa Lúcia, Minas Gerais","Apartamento para Aluguel - Santa Lúcia, 3 Quartos, 110 m2",/imovel/aluguel-apartamento-3-quartos-santa-lucia-belo-horizonte-mg-110m2-id-2558846732/,QUINTO ANDAR SERVICOS IMOBILIARIOS LTDA,2558846732,['APARTMENT']
1680.0,340.0,72.0,3,2,2,122.0,"Rua Professor João Batista Alvarenga, Concórdia, Minas Gerais","Apartamento para Aluguel - Concórdia, 3 Quartos, 72 m2",/imovel/aluguel-apartamento-3-quartos-concordia-belo-horizonte-mg-72m2-id-2558634124/,QUINTO ANDAR SERVICOS IMOBILIARIOS LTDA,2558634124,['APARTMENT']
1800.0,750.0,75.0,2,2,2,260.0,"Rua Bolívia, São Pedro, Minas Gerais","Apartamento para Aluguel - São Pedro, 2 Quartos, 75 m2",/imovel/aluguel-apartamento-2-quartos-com-piscina-sao-pedro-belo-horizonte-mg-75m2-id-2558637068/,QUINTO ANDAR SERVICOS IMOBILIARIOS LTDA,2558637068,['APARTMENT']
1600.0,313.0,60.0,2,2,2,0.0,"Santa Cruz, Minas Gerais",BELO HOIZONTE - Padrão - Palmares,/imovel/aluguel-apartamento-2-quartos-santa-cruz-belo-horizonte-mg-60m2-id-2558648887/,RN IMOVEIS,2558648887,['APARTMENT']
2800.0,390.0,70.0,2,2,2,350.0,"Gutierrez, Minas Gerais","Apartamento com 2 dormitórios para alugar, 70 m² por R$ 2.800,00 - Gutierrez - Belo Horizonte/MG",/imovel/aluguel-apartamento-2-quartos-com-elevador-gutierrez-belo-horizonte-mg-70m2-id-2557974492/,ALUGUE JÁ BH,2557974492,['APARTMENT']
2500.0,450.0,65.0,2,2,1,150.0,"Rua Eli Seabra Filho, Buritis, Minas Gerais","Apartamento com 2 dormitórios para alugar, 65 m² por R$ 2.500,00/mês - Buritis - Belo Horizonte/MG",/imovel/aluguel-apartamento-2-quartos-mobiliado-buritis-belo-horizonte-mg-65m2-id-2558664230/,BIHAIN NEGOCIOS IMOBILIARIOS,2558664230,['APARTMENT']
2800.0,260.0,55.0,2,2,2,196.0,"Lourdes, Minas Gerais",Belo Horizonte - Apartamento Padrão - Lourdes,/imovel/aluguel-apartamento-2-quartos-com-interfone-lourdes-belo-horizonte-mg-55m2-id-2558472057/,Residencial Locação e Venda de Imóveis Ltda,2558472057,['APARTMENT']
2500.0,600.0,70.0,2,1,2,223.0,"Rua Paracatu, Santo Agostinho, Minas Gerais",Apartamento 02 qaurtos excelente localização,/imovel/aluguel-apartamento-2-quartos-com-piscina-santo-agostinho-belo-horizonte-mg-70m2-id-2554240953/,Marcos Luiz Ferreira Gomes,2554240953,['APARTMENT']
3200.0,260.0,55.0,2,2,2,179.0,"Rua Rio Grande do Sul, Santo Agostinho, Minas Gerais","Apartamento para Aluguel - Santo Agostinho, 2 Quartos, 55 m2",/imovel/aluguel-apartamento-2-quartos-santo-agostinho-belo-horizonte-mg-55m2-id-2558674537/,QUINTO ANDAR SERVICOS IMOBILIARIOS LTDA,2558674537,['APARTMENT']
3500.0,490.0,120.0,4,2,4,305.0,"Rua Paula Cândido, Gutierrez, Minas Gerais","Apartamento para Aluguel - Gutierrez, 4 Quartos, 120 m2",/imovel/aluguel-apartamento-4-quartos-gutierrez-belo-horizonte-mg-120m2-id-2558827224/,QUINTO ANDAR SERVICOS IMOBILIARIOS LTDA,2558827224,['APARTMENT']
1600.0,510.0,105.0,2,2,1,194.0,"Vila Paris, Minas Gerais",Apartamento para aluguel com 02 quartos,/imovel/aluguel-apartamento-2-quartos-com-salao-de-festas-vila-paris-belo-horizonte-mg-105m2-id-2558545905/,LLA Consultoria Imobiliária Compra e Venda Ltda,2558545905,['APARTMENT']
2300.0,450.0,43.0,1,1,1,143.0,"Avenida dos Bandeirantes, Sion, Minas Gerais","Apartamento para Aluguel - Sion, 1 Quarto, 43 m2",/imovel/aluguel-apartamento-1-quarto-mobiliado-sion-belo-horizonte-mg-43m2-id-2558843873/,QUINTO ANDAR SERVICOS IMOBILIARIOS LTDA,2558843873,['APARTMENT']
1600.0,800.0,62.0,2,1,2,293.0,"Luxemburgo, Minas Gerais","Apartamento com 2 dormitórios para alugar, 62 m² por R$ 1.600,00/mês - Luxemburgo - Belo Horizonte/M",/imovel/aluguel-apartamento-2-quartos-luxemburgo-belo-horizonte-mg-62m2-id-2558843455/,Hypolito Imóveis,2558843455,['APARTMENT']
2500.0,450.0,130.0,3,3,1,343.0,"Rua Mestre Lucas, Cruzeiro, Minas Gerais","Apartamento para Aluguel - Cruzeiro, 3 Quartos, 130 m2",/imovel/aluguel-apartamento-3-quartos-cruzeiro-belo-horizonte-mg-130m2-id-2558829611/,QUINTO ANDAR SERVICOS IMOBILIARIOS LTDA,2558829611,['APARTMENT']
1000.0,200.0,35.0,2,1,1,0.0,"Rua Professor Carlos Tunes, Palmeiras, Minas Gerais","Apartamento para aluguel, 2 quartos, 1 vaga, Palmeiras - Belo Horizonte/MG",/imovel/aluguel-apartamento-2-quartos-palmeiras-belo-horizonte-mg-35m2-id-2558909367/,Utilbrás Imóveis - Aluguel,2558909367,['APARTMENT']
2750.0,281.0,85.0,3,2,2,215.0,"Renascença, Minas Gerais","Apartamento com 3 dormitórios para alugar, 85 m² por R$ 2.750,00/mês - Renascença - Belo Horizonte/M",/imovel/aluguel-apartamento-3-quartos-com-cozinha-renascenca-belo-horizonte-mg-85m2-id-2558668269/,Halugar Imóveis e Seguros,2558668269,['APARTMENT']
2200.0,500.0,100.0,3,2,2,100.0,"Rua Carlos Peixoto, São Lucas, Minas Gerais","Apartamento para Aluguel - São Lucas, 3 Quartos, 100 m2",/imovel/aluguel-apartamento-3-quartos-sao-lucas-belo-horizonte-mg-100m2-id-2558635200/,QUINTO ANDAR SERVICOS IMOBILIARIOS LTDA,2558635200,['APARTMENT']
2290.0,790.0,40.0,1,1,0,1541.0,"Savassi, Minas Gerais","Apartamento para aluguel, 1 quarto, 1 suíte, Savassi - Belo Horizonte/MG",/imovel/aluguel-apartamento-1-quarto-mobiliado-savassi-belo-horizonte-mg-40m2-id-2552064490/,LAR IMÓVEIS LOCAÇÃO,2552064490,['APARTMENT']
2300.0,385.0,150.0,3,2,1,2466.0,"Santo Antônio, Minas Gerais","Apartamento para aluguel, 3 quartos, 1 suíte, 1 vaga, Santo Antônio - Belo Horizonte/MG",/imovel/aluguel-apartamento-3-quartos-santo-antonio-belo-horizonte-mg-150m2-id-2554744929/,LAR IMÓVEIS LOCAÇÃO,2554744929,['APARTMENT']
12000.0,2556.0,306.0,4,4,4,17244.0,"Lourdes, Minas Gerais","Apartamento para aluguel, 4 quartos, 4 suítes, 4 vagas, Lourdes - Belo Horizonte/MG",/imovel/aluguel-apartamento-4-quartos-com-churrasqueira-lourdes-belo-horizonte-mg-306m2-id-2552064788/,LAR IMÓVEIS LOCAÇÃO,2552064788,['APARTMENT']
2400.0,600.0,130.0,4,2,2,241.0,"Rua Doutor Juvenal dos Santos, Luxemburgo, Minas Gerais","Apartamento para Aluguel - Luxemburgo, 4 Quartos, 130 m2",/imovel/aluguel-apartamento-4-quartos-luxemburgo-belo-horizonte-mg-130m2-id-2558576213/,QUINTO ANDAR SERVICOS IMOBILIARIOS LTDA,2558576213,['APARTMENT']
2500.0,350.0,60.0,2,2,2,0.0,"Rua Doutor Plínio de Morais, Cidade Nova, Minas Gerais","Apartamento para Aluguel - Cidade Nova, 2 Quartos, 60 m2",/imovel/aluguel-apartamento-2-quartos-cidade-nova-belo-horizonte-mg-60m2-id-2558458230/,QUINTO ANDAR SERVICOS IMOBILIARIOS LTDA,2558458230,['APARTMENT']
2650.0,680.0,70.0,2,2,2,220.0,"Rua Flavita Bretas, Luxemburgo, Minas Gerais","Apartamento para Aluguel - Luxemburgo, 2 Quartos, 70 m2",/imovel/aluguel-apartamento-2-quartos-com-academia-luxemburgo-belo-horizonte-mg-70m2-id-2557614774/,QUINTO ANDAR SERVICOS IMOBILIARIOS LTDA,2557614774,['APARTMENT']
1200.0,250.0,68.0,2,2,1,95.0,"Santa Inês, Minas Gerais",Belo Horizonte - Apartamento Padrão - Santa Inês,/imovel/aluguel-apartamento-2-quartos-com-elevador-santa-ines-belo-horizonte-mg-68m2-id-2558270972/,LedimoveisBH,2558270972,['APARTMENT']
2600.0,795.0,67.0,2,2,1,288.0,"Rua Cláudio Manoel, Savassi, Minas Gerais","Apartamento para aluguel, 2 quartos, 1 suíte, 1 vaga, Savassi - Belo Horizonte/MG",/imovel/aluguel-apartamento-2-quartos-com-piscina-savassi-belo-horizonte-mg-67m2-id-2558901623/,ERA EMPREENDIMENTOS ALUGUEL,2558901623,['APARTMENT']
2900.0,250.0,120.0,4,2,1,197.0,"Rua República Argentina, Sion, Minas Gerais","Apartamento para Aluguel - Sion, 4 Quartos, 120 m2",/imovel/aluguel-apartamento-4-quartos-sion-belo-horizonte-mg-120m2-id-2558459507/,QUINTO ANDAR SERVICOS IMOBILIARIOS LTDA,2558459507,['APARTMENT']
1100.0,464.0,51.0,2,2,1,93.0,"Rua Zurick, Nova Suíssa, Minas Gerais",Apartamento para alugar com 02 quartos em Nova Su??a.,/imovel/aluguel-apartamento-2-quartos-com-salao-de-festas-nova-suissa-belo-horizonte-mg-51m2-id-2558263487/,UNIAO CORRETORA DE IMOVEIS LTDA,2558263487,['APARTMENT']
3000.0,250.0,50.0,2,1,1,250.0,"Rua Alagoas, Savassi, Minas Gerais",Apartamento para aluguel possui 50 m² com 2 suítes,/imovel/aluguel-apartamento-2-quartos-com-elevador-savassi-belo-horizonte-mg-50m2-id-2558262785/,Construtora Sólido Engenharia,2558262785,['APARTMENT']
1600.0,342.0,58.0,2,2,1,145.0,"Rua Monte Sião, Serra, Minas Gerais","Apartamento com 2 dormitórios para alugar, 58 m² por R$ 1.600,00/mês - Serra - Belo Horizonte/MG",/imovel/aluguel-apartamento-2-quartos-com-elevador-serra-belo-horizonte-mg-58m2-id-2558484407/,Pactuar Negócios Imobiliários Eireli,2558484407,['APARTMENT']
2800.0,450.0,65.0,2,2,2,150.0,"Santa Efigênia, Minas Gerais",BELO HORIZONTE - Apartamento Padrão - Santa Efigênia,/imovel/aluguel-apartamento-2-quartos-com-interfone-santa-efigenia-belo-horizonte-mg-65m2-id-2558941059/,Alexandre Saraiva De Carvalho,2558941059,['APARTMENT']
2700.0,512.0,70.0,3,2,2,176.0,"Rua Costa Monteiro, Sagrada Família, Minas Gerais",Apartamento com 3 dormitórios para alugar em Belo Horizonte,/imovel/aluguel-apartamento-3-quartos-sagrada-familia-belo-horizonte-mg-70m2-id-2558706442/,INOVA PLATAFORMA DE INTEGRACAO,2558706442,['APARTMENT']
2600.0,547.0,78.0,2,2,1,218.0,"Rua Alagoas, Savassi, Minas Gerais","Apartamento para Aluguel - Savassi, 2 Quartos, 78 m2",/imovel/aluguel-apartamento-2-quartos-com-academia-savassi-belo-horizonte-mg-78m2-id-2558843876/,QUINTO ANDAR SERVICOS IMOBILIARIOS LTDA,2558843876,['APARTMENT']
2500.0,693.0,95.0,3,3,2,254.0,"Rua Conselheiro Joaquim Caetano, Jardim América, Minas Gerais","Apartamento com 3 dormitórios para alugar, 95 m² por R$ 2.500,00/mês - Jardim America - Belo Horizon",/imovel/aluguel-apartamento-3-quartos-com-piscina-jardim-america-belo-horizonte-mg-95m2-id-2558665790/,BIHAIN NEGOCIOS IMOBILIARIOS,2558665790,['APARTMENT']
1900.0,60.0,140.0,3,3,0,0.0,"Rua Rio Casca, Carlos Prates, Minas Gerais","Apartamento com 3 quartos para alugar, 140 m² por R$ 1.900/mês - Carlos Prates - Belo Horizonte/MG",/imovel/aluguel-apartamento-3-quartos-com-interfone-carlos-prates-belo-horizonte-mg-140m2-id-2558838453/,VIA NOBRE ALUGUEL,2558838453,['APARTMENT']
1100.0,220.0,50.0,2,1,1,0.0,"Rua Padre Leopoldo Mertens, São Francisco, Minas Gerais","Apartamento para Aluguel - São Francisco, 2 Quartos, 50 m2",/imovel/aluguel-apartamento-2-quartos-sao-francisco-belo-horizonte-mg-50m2-id-2558845903/,QUINTO ANDAR SERVICOS IMOBILIARIOS LTDA,2558845903,['APARTMENT']
1800.0,390.0,86.0,3,2,2,0.0,"João Pinheiro, Minas Gerais",Belo Horizonte - Apartamento Padrão - João Pinheiro,/imovel/aluguel-apartamento-3-quartos-com-interfone-joao-pinheiro-belo-horizonte-mg-86m2-id-2558472056/,Residencial Locação e Venda de Imóveis Ltda,2558472056,['APARTMENT']
850.0,372.0,50.0,2,1,1,71.0,"Camargos, Minas Gerais",,/imovel/aluguel-apartamento-2-quartos-camargos-belo-horizonte-mg-50m2-id-2558553285/,Leonardo Flavio de Carvalho,2558553285,['APARTMENT']
2400.0,230.0,60.0,2,2,2,100.0,"Ouro Preto, Minas Gerais",Apartamento para locação no Bairro Ouro Preto!,/imovel/aluguel-apartamento-2-quartos-ouro-preto-belo-horizonte-mg-60m2-id-2558901390/,Inovi Soluções Imobiliárias,2558901390,['APARTMENT']
2900.0,700.0,85.0,2,2,2,180.0,"Avenida Aggeo Pio Sobrinho, Buritis, Minas Gerais","Apartamento com 2 dormitórios para alugar, 85 m² por R$ 2.900,00/mês - Buritis - Belo Horizonte/MG",/imovel/aluguel-apartamento-2-quartos-com-piscina-buritis-belo-horizonte-mg-85m2-id-2558663929/,BIHAIN NEGOCIOS IMOBILIARIOS,2558663929,['APARTMENT']
1200.0,590.0,55.0,2,2,1,86.0,"Rua Jornalista Tarcísio Henriques, Castelo, Minas Gerais","Apartamento para Aluguel - Castelo, 2 Quartos, 55 m2",/imovel/aluguel-apartamento-2-quartos-com-piscina-castelo-belo-horizonte-mg-55m2-id-2558356952/,QUINTO ANDAR SERVICOS IMOBILIARIOS LTDA,2558356952,['APARTMENT']
1900.0,400.0,130.0,3,2,2,271.0,"Rua Itutinga, Minas Brasil, Minas Gerais",Apartamento com 3 quartos e 2 vagas,/imovel/aluguel-apartamento-3-quartos-com-salao-de-festas-minas-brasil-belo-horizonte-mg-130m2-id-2558812301/,SOUSA E REIS ASSESSORIA IMOBILIARIA LTDA - ME,2558812301,['APARTMENT']
1200.0,250.0,61.0,3,1,1,374.0,"Cinqüentenário, Minas Gerais","Apartamento para aluguel, 3 quartos, 1 vaga, Cinqüentenário - Belo Horizonte/MG",/imovel/aluguel-apartamento-3-quartos-com-seguranca-interna-cinquentenario-belo-horizonte-mg-61m2-id-2556169649/,LAR IMÓVEIS LOCAÇÃO,2556169649,['APARTMENT']
4990.0,1948.0,225.0,4,2,2,7075.0,"Lourdes, Minas Gerais","Apartamento para aluguel, 4 quartos, 1 suíte, 2 vagas, Lourdes - Belo Horizonte/MG",/imovel/aluguel-apartamento-4-quartos-com-quadra-poliesportiva-lourdes-belo-horizonte-mg-225m2-id-2552064392/,LAR IMÓVEIS LOCAÇÃO,2552064392,['APARTMENT']
1750.0,420.0,75.0,2,2,1,117.0,"Colégio Batista, Minas Gerais","Apartamento para aluguel, 2 quartos, 1 vaga, Colégio Batista - Belo Horizonte/MG",/imovel/aluguel-apartamento-2-quartos-com-salao-de-festas-colegio-batista-belo-horizonte-mg-75m2-id-2556168208/,LAR IMÓVEIS LOCAÇÃO,2556168208,['APARTMENT']
2000.0,200.0,85.0,3,1,2,2473.0,"Rua João Gualberto Filho, Sagrada Família, Minas Gerais","Apartamento para aluguel, 3 quartos, 1 suíte, 2 vagas, Sagrada Família - Belo Horizonte/MG",/imovel/aluguel-apartamento-3-quartos-sagrada-familia-belo-horizonte-mg-85m2-id-2558909696/,Utilbrás Imóveis - Aluguel,2558909696,['APARTMENT']
1800.0,450.0,60.0,2,2,2,100.0,"Castelo, Minas Gerais",Apartamento em Belo Horizonte - Castelo,/imovel/aluguel-apartamento-2-quartos-com-cozinha-castelo-belo-horizonte-mg-60m2-id-2558670575/,Viabilitá Negócios Imobiliários,2558670575,['APARTMENT']
3500.0,936.0,135.0,4,2,3,492.0,"Rua Vinícius de Morais, Luxemburgo, Minas Gerais","Apartamento para Aluguel - Luxemburgo, 4 Quartos, 135 m2",/imovel/aluguel-apartamento-4-quartos-com-piscina-luxemburgo-belo-horizonte-mg-135m2-id-2558531102/,QUINTO ANDAR SERVICOS IMOBILIARIOS LTDA,2558531102,['APARTMENT']
2450.0,669.0,130.0,3,3,2,205.0,"Rua Deputado Álvaro Sales, Santo Antônio, Minas Gerais",Vend/Alug - APARTAMENTO - SANTO ANTONIO BELO HORIZONTE MG,/imovel/venda-apartamento-3-quartos-com-salao-de-festas-santo-antonio-belo-horizonte-mg-130m2-id-2556739099/,Mangabeiras Imóveis Ltda,2556739099,['APARTMENT']
1600.0,302.0,57.0,2,2,1,99.0,"Rua Açucenas, Nova Suíssa, Minas Gerais","Apartamento para Aluguel - Nova Suissa, 2 Quartos, 57 m2",/imovel/aluguel-apartamento-2-quartos-com-espaco-gourmet-nova-suissa-belo-horizonte-mg-57m2-id-2558456721/,QUINTO ANDAR SERVICOS IMOBILIARIOS LTDA,2558456721,['APARTMENT']
2300.0,400.0,90.0,3,2,1,155.0,"Rua João Arantes, Cidade Nova, Minas Gerais","Apartamento para Aluguel - Cidade Nova, 3 Quartos, 90 m2",/imovel/aluguel-apartamento-3-quartos-com-ar-condicionado-cidade-nova-belo-horizonte-mg-90m2-id-2558636872/,QUINTO ANDAR SERVICOS IMOBILIARIOS LTDA,2558636872,['APARTMENT']
1620.0,253.0,96.0,3,2,2,120.0,"Rua Deputado Wilson Tanure, Santa Amélia, Minas Gerais",APARTAMENTO 3 QUARTOS 2 VAGAS - SANTA AMÉLIA,/imovel/aluguel-apartamento-3-quartos-com-ar-condicionado-santa-amelia-belo-horizonte-mg-96m2-id-2558325389/,ARBO IMÓVEIS,2558325389,['APARTMENT']
3000.0,680.0,78.0,3,2,2,345.0,"Rua Professor Moraes, Savassi, Minas Gerais",Vend/Alug - APARTAMENTO - SAVASSI BELO HORIZONTE MG,/imovel/venda-apartamento-3-quartos-com-churrasqueira-savassi-belo-horizonte-mg-78m2-id-2558557424/,Mangabeiras Imóveis Ltda,2558557424,['APARTMENT']
2100.0,355.0,70.0,2,1,1,96.0,"Rua Rio Doce, São Lucas, Minas Gerais","Apartamento para Aluguel - São Lucas, 2 Quartos, 70 m2",/imovel/aluguel-apartamento-2-quartos-sao-lucas-belo-horizonte-mg-70m2-id-2558636865/,QUINTO ANDAR SERVICOS IMOBILIARIOS LTDA,2558636865,['APARTMENT']
1900.0,0.0,80.0,2,3,2,0.0,"Rua Miguel Abras, Serra, Minas Gerais",EXCELENTE APTO 2 QUARTOS - VISTA CLUBE OLYMPICO,/imovel/aluguel-apartamento-2-quartos-com-piscina-serra-belo-horizonte-mg-80m2-id-2558547079/,M.GODOY - Claudia,2558547079,['APARTMENT']
2511.0,250.0,89.0,3,2,2,140.0,"Rua General Ephigênio Ruas Santos, Itapoã, Minas Gerais","Apartamento mobiliado, 3 Quartos, sendo 1 Suíte, 2 vagas cobertas, Bairro Itapoa - Belo Horizonte",/imovel/aluguel-apartamento-3-quartos-com-cozinha-itapoa-belo-horizonte-mg-89m2-id-2557663681/,ARBO IMÓVEIS,2557663681,['APARTMENT']
1550.0,330.0,79.0,2,1,1,60.0,"Rua Dom Prudêncio Gomes, Coração Eucarístico, Minas Gerais","Apartamento para Aluguel - Coração Eucarístico, 2 Quartos, 79 m2",/imovel/aluguel-apartamento-2-quartos-coracao-eucaristico-belo-horizonte-mg-79m2-id-2558576512/,QUINTO ANDAR SERVICOS IMOBILIARIOS LTDA,2558576512,['APARTMENT']
1620.0,253.0,96.0,3,2,2,120.0,"Rua Deputado Wilson Tanure, Santa Amélia, Minas Gerais",APARTAMENTO 3 QUARTOS 2 VAGAS - SANTA AMÉLIA,/imovel/aluguel-apartamento-3-quartos-com-ar-condicionado-santa-amelia-belo-horizonte-mg-96m2-id-2558342715/,Deltalar Negócios Imobiliários Ltda-ME,2558342715,['APARTMENT']
1400.0,240.0,26.0,1,1,1,153.0,"Rua Silva Fortes, União, Minas Gerais",Locação Apartamento 1 quarto União Belo Horizonte,/imovel/aluguel-apartamento-1-quarto-com-elevador-uniao-belo-horizonte-mg-26m2-id-2558656494/,3RG IMOVEIS LTDA,2558656494,['APARTMENT']
1600.0,520.0,70.0,2,3,1,120.0,"Rua Helena Mesquita, Nova Suíssa, Minas Gerais","ALUGUE APTO 2 QUARTOS, NO MELHOR PONTO DO NOVA SUÍSSA!",/imovel/aluguel-apartamento-2-quartos-nova-suissa-belo-horizonte-mg-70m2-id-2554111512/,DANIELA PINHEIRO IMÓVEIS,2554111512,['APARTMENT']
2200.0,300.0,55.0,2,2,1,133.0,"Rua Luiza Carvalho Torres, Santo Antônio, Minas Gerais","Apartamento para Aluguel - Santo Antônio, 2 Quartos, 55 m2",/imovel/aluguel-apartamento-2-quartos-mobiliado-santo-antonio-belo-horizonte-mg-55m2-id-2558459600/,QUINTO ANDAR SERVICOS IMOBILIARIOS LTDA,2558459600,['APARTMENT']
2500.0,450.0,88.0,3,3,2,190.0,"Rua Fidélis Martins, Buritis, Minas Gerais","Apartamento com 3 dormitórios para alugar, 88 m² por R$ 2.500,00/mês - Buritis - Belo Horizonte/MG",/imovel/aluguel-apartamento-3-quartos-com-elevador-buritis-belo-horizonte-mg-88m2-id-2558612698/,BIHAIN IMOVEIS ALUGUEL,2558612698,['APARTMENT']
3500.0,550.0,84.0,3,2,3,140.0,"Rua São Claret, Silveira, Minas Gerais","Apartamento para Aluguel - Silveira, 3 Quartos, 84 m2",/imovel/aluguel-apartamento-3-quartos-mobiliado-silveira-belo-horizonte-mg-84m2-id-2558277244/,QUINTO ANDAR SERVICOS IMOBILIARIOS LTDA,2558277244,['APARTMENT']
1950.0,515.0,83.0,3,2,2,167.0,"Planalto, Minas Gerais",Belo Horizonte - Apartamento Padrão - Planalto,/imovel/aluguel-apartamento-3-quartos-com-piscina-planalto-belo-horizonte-mg-83m2-id-2558650600/,VERPLAN PLANEJAMENTO E NEGOCIOS IMOBILIARIOS LTDA,2558650600,['APARTMENT']
1890.0,220.0,85.0,3,3,2,167.0,"Rua Doutor José Silva Martins, Cidade Nova, Minas Gerais",Apartamento com 3 dormitórios para alugar em Belo Horizonte,/imovel/aluguel-apartamento-3-quartos-cidade-nova-belo-horizonte-mg-85m2-id-2557706964/,INOVA PLATAFORMA DE INTEGRACAO,2557706964,['APARTMENT']
2500.0,380.0,80.0,2,2,1,265.0,"Rua dos Timbiras, Funcionários, Minas Gerais",Belo Horizonte - Apartamento Padrão - Funcionários,/imovel/aluguel-apartamento-2-quartos-com-elevador-funcionarios-belo-horizonte-mg-80m2-id-2558262101/,Digimóveis,2558262101,['APARTMENT']
4990.0,1948.0,225.0,4,2,2,7075.0,"Lourdes, Minas Gerais","Apartamento para aluguel, 4 quartos, 1 suíte, 2 vagas, Lourdes - Belo Horizonte/MG",/imovel/aluguel-apartamento-4-quartos-com-quadra-poliesportiva-lourdes-belo-horizonte-mg-225m2-id-2552064392/,LAR IMÓVEIS LOCAÇÃO,2552064392,['APARTMENT']
3200.0,635.0,42.0,1,1,1,326.0,"Rua Antônio de Albuquerque, Savassi, Minas Gerais","Apartamento para aluguel, 1 quarto, 1 suíte, 1 vaga, Savassi - Belo Horizonte/MG",/imovel/aluguel-apartamento-1-quarto-com-piscina-savassi-belo-horizonte-mg-42m2-id-2556533163/,RC NUNES,2556533163,['APARTMENT']
5000.0,1650.0,220.0,4,5,3,8910.0,"Serra, Minas Gerais","Apartamento para aluguel, 4 quartos, 2 suítes, 3 vagas, Serra - Belo Horizonte/MG",/imovel/aluguel-apartamento-4-quartos-com-piscina-serra-belo-horizonte-mg-220m2-id-2552062522/,LAR IMÓVEIS LOCAÇÃO,2552062522,['APARTMENT']
1400.0,250.0,60.0,3,2,2,127.0,"Rua Francisco Bicalho, Caiçaras, Minas Gerais",Apartamento em excelente localização no Caiçara.,/imovel/aluguel-apartamento-3-quartos-com-jardim-caicaras-belo-horizonte-mg-60m2-id-2558541586/,PIVA IMÓVEIS,2558541586,['APARTMENT']
2000.0,280.0,80.0,3,2,2,198.0,"Rua Duarte da Costa, Jaraguá, Minas Gerais","Apartamento com 3 dormitórios para alugar, 80 m² por R$ 2.000,00/mês - Jaraguá - Belo Horizonte/MG",/imovel/aluguel-apartamento-3-quartos-com-cozinha-jaragua-belo-horizonte-mg-80m2-id-2558875003/,GF Imóveis,2558875003,['APARTMENT']
3000.0,638.0,68.0,2,2,2,288.0,"Rua dos Timbiras, Barro Preto, Minas Gerais",2 QTOS SUÍTE LAZER 2VGS EM FRENTE AO HOSP VERA CRUZ,/imovel/aluguel-apartamento-2-quartos-com-piscina-barro-preto-belo-horizonte-mg-68m2-id-2558408979/,GERÊNCIA ADMINISTRADORA DE BENS LTDA,2558408979,['APARTMENT']
1600.0,430.0,75.0,3,2,1,88.0,"Rua Centralina, Santa Inês, Minas Gerais","Apartamento para Aluguel - Santa Inês, 3 Quartos, 75 m2",/imovel/aluguel-apartamento-3-quartos-com-piscina-santa-ines-belo-horizonte-mg-75m2-id-2558637263/,QUINTO ANDAR SERVICOS IMOBILIARIOS LTDA,2558637263,['APARTMENT']
2300.0,530.0,70.0,2,2,2,280.0,"Rua Montes Claros, Anchieta, Minas Gerais","Apartamento para aluguel, 2 quartos, 1 suíte, 2 vagas, Anchieta - Belo Horizonte/MG",/imovel/aluguel-apartamento-2-quartos-com-salao-de-festas-anchieta-belo-horizonte-mg-70m2-id-2558850659/,Anuar Donato Consultoria Imobiliária,2558850659,['APARTMENT']
