Price,Condominium,FloorSize,NumberOfBedrooms,NumberOfBathrooms,ParkingSpaces,IPTU,Address,Title,Link,Publisher,ItemID,UnitTypes
1590.0,120.0,70.0,3,2,1,83.0,"Nova Gameleira, Minas Gerais",Cobertura com 03 quartos,/imovel/aluguel-apartamento-3-quartos-com-interfone-nova-gameleira-belo-horizonte-mg-70m2-id-2558795040/,Administradora Minas Brasil,2558795040,['APARTMENT']
2800.0,400.0,62.0,2,2,2,263.0,"Rua Caratinga, Anchieta, Minas Gerais","Apartamento para Aluguel - Anchieta, 2 Quartos, 62 m2",/imovel/aluguel-apartamento-2-quartos-anchieta-belo-horizonte-mg-62m2-id-2558048455/,QUINTO ANDAR SERVICOS IMOBILIARIOS LTDA,2558048455,['APARTMENT']
1450.0,200.0,130.0,3,3,0,222.0,"Santo Agostinho, Minas Gerais",Belo Horizonte - Apartamento Padrão - Santo Agostinho,/imovel/aluguel-apartamento-3-quartos-com-interfone-santo-agostinho-belo-horizonte-mg-130m2-id-2558846550/,TODDUS IMÓVEIS,2558846550,['APARTMENT']
2650.0,450.0,138.0,3,3,2,294.0,"Rua Odilon Braga, Anchieta, Minas Gerais",Belo Horizonte - Apartamento Padrão - Anchieta,/imovel/aluguel-apartamento-3-quartos-anchieta-belo-horizonte-mg-138m2-id-2557211581/,Imobplace Corretores Associados,2557211581,['APARTMENT']
1200.0,300.0,50.0,2,2,1,145.0,"Santo Antônio, Minas Gerais",Aluguel - APARTAMENTO - SANTO ANTONIO Belo Horizonte MG,/imovel/aluguel-apartamento-2-quartos-santo-antonio-belo-horizonte-mg-50m2-id-2557359655/,BEAGA EMPRENDIMENTOS,2557359655,['APARTMENT']
1100.0,180.0,49.0,2,2,1,82.0,"Rua Raul Seixas, Manacás, Minas Gerais","Apartamento para Aluguel - Manacás, 2 Quartos, 49 m2",/imovel/aluguel-apartamento-2-quartos-manacas-belo-horizonte-mg-49m2-id-2556607892/,QUINTO ANDAR SERVICOS IMOBILIARIOS LTDA,2556607892,['APARTMENT']
3000.0,190.0,35.0,1,1,1,150.0,"Avenida Álvares Cabral, Lourdes, Minas Gerais",Apartamento para aluguel tem 35 m² com 1 quarto em Lourdes - Belo Horizonte - MG,/imovel/aluguel-apartamento-1-quarto-mobiliado-lourdes-belo-horizonte-mg-35m2-id-2558709593/,Construtora Sólido Engenharia,2558709593,['APARTMENT']
2000.0,540.0,80.0,2,1,2,197.0,"Rua Carolina Figueiredo, Serra, Minas Gerais","Apartamento para aluguel, 2 quartos, 2 suítes, 2 vagas, Serra - Belo Horizonte/MG",/imovel/aluguel-apartamento-2-quartos-serra-belo-horizonte-mg-80m2-id-2558510119/,Campos Guimarães Imóveis - Unidade Lourdes,2558510119,['APARTMENT']
2900.0,560.0,100.0,3,3,2,192.0,"Rua Industrial José Costa, Nova Granada, Minas Gerais","Apartamento com 3 dormitórios para alugar, 100 m² por R$ 2.900,00/mês - Nova Granada - Belo Horizont",/imovel/aluguel-apartamento-3-quartos-com-cozinha-nova-granada-belo-horizonte-mg-100m2-id-2557934538/,REMAX ALFA,2557934538,['APARTMENT']
1300.0,350.0,55.0,2,1,1,84.0,"Rua Gávea, Nova Suíssa, Minas Gerais","Apartamento para Aluguel - Nova Suissa, 2 Quartos, 55 m2",/imovel/aluguel-apartamento-2-quartos-nova-suissa-belo-horizonte-mg-55m2-id-2558650611/,QUINTO ANDAR SERVICOS IMOBILIARIOS LTDA,2558650611,['APARTMENT']
1900.0,100.0,84.0,3,1,2,0.0,"Rua Maria Paschoal Gatti, Barreiro, Minas Gerais","Apartamento para aluguel, 3 quartos, 1 suíte, 2 vagas, Barreiro - Belo Horizonte/MG",/imovel/aluguel-apartamento-3-quartos-barreiro-belo-horizonte-mg-84m2-id-2558919601/,Campos Guimarães Imóveis - Unidade Barreiro,2558919601,['APARTMENT']
1800.0,0.0,85.0,3,2,2,104.0,"Rua Boqueirão, Betânia, Minas Gerais","Apartamento para aluguel, 3 quartos, 1 suíte, 2 vagas, Betânia - Belo Horizonte/MG",/imovel/aluguel-apartamento-3-quartos-com-churrasqueira-betania-belo-horizonte-mg-85m2-id-2558866472/,GR IMOVEIS  ALUGUEL,2558866472,['APARTMENT']
1300.0,300.0,55.0,2,1,1,72.0,"Rua Zurick, Calafate, Minas Gerais",BELO HORIZONTE - Apartamento Padrão - Calafate,/imovel/aluguel-apartamento-2-quartos-com-interfone-calafate-belo-horizonte-mg-55m2-id-2558009924/,FOX IMOBILIARIA,2558009924,['APARTMENT']
1500.0,380.0,55.0,2,2,0,0.0,"Dona Clara, Minas Gerais",BELO HORIZONTE - Apartamento Padrão - Dona Clara,/imovel/aluguel-apartamento-2-quartos-com-armario-embutido-dona-clara-belo-horizonte-mg-55m2-id-2558830966/,Tigre Imobiliária,2558830966,['APARTMENT']
2400.0,880.0,90.0,3,3,2,280.0,"Serra, Minas Gerais","3 quartos/suíte, 2 vagas, laser completo",/imovel/aluguel-apartamento-3-quartos-com-piscina-serra-belo-horizonte-mg-90m2-id-2557832878/,Aleixo Imóveis Ltda - ME,2557832878,['APARTMENT']
1800.0,700.0,88.0,3,2,2,145.0,"Prado, Minas Gerais",Belo Horizonte - Apartamento Padrão - Prado,/imovel/aluguel-apartamento-3-quartos-mobiliado-prado-belo-horizonte-mg-88m2-id-2557788569/,AURA CORRETORA DE IMÓVEIS LTDA ME,2557788569,['APARTMENT']
1630.0,645.0,26.0,1,1,0,175.0,"Rua José Amaury Ferrara, Buritis, Minas Gerais",Apartamento de 26 metros quadrados no bairro Buritis com 1 quarto,/imovel/aluguel-quitinete-1-quarto-mobiliado-buritis-belo-horizonte-mg-26m2-id-2427549298/,Condomínio do Horizonte Hotel,2427549298,['APARTMENT']
1200.0,330.0,14.0,1,2,0,0.0,"Avenida Padre Vieira, Minas Brasil, Minas Gerais","Kitnet - Minas Brasil - Belo Horizonte - R$ 1.200,00",/imovel/aluguel-quitinete-1-quarto-mobiliado-minas-brasil-belo-horizonte-mg-14m2-id-2558211382/,UP ESTATE IMÓVEIS,2558211382,['APARTMENT']
1350.0,330.0,26.0,1,1,0,0.0,"Avenida Padre Vieira, Coração Eucarístico, Minas Gerais","Kitnet Minas Brasil - Belo Horizonte R$ 1.350,00",/imovel/aluguel-quitinete-1-quarto-mobiliado-coracao-eucaristico-belo-horizonte-mg-26m2-id-2558213453/,UP ESTATE IMÓVEIS,2558213453,['APARTMENT']
700.0,50.0,35.0,2,1,1,40.0,"Rua Ministro Hermenegildo de Barros, Itapoã, Minas Gerais",Kitnet para locação com 2 quartos 1 vaga - Bairro Itapoã,/imovel/aluguel-quitinete-2-quartos-itapoa-belo-horizonte-mg-35m2-id-2552927311/,PONTO IMOBILIÁRIO,2552927311,['APARTMENT']
1300.0,650.0,35.0,1,1,1,100.0,"Coração Eucarístico, Minas Gerais","Kitnet com 1 dormitório, 35 m² - venda por R$ 250.000,00 ou aluguel por R$ 1.300,00/mês - Coração Eu",/imovel/venda-quitinete-1-quarto-mobiliado-coracao-eucaristico-belo-horizonte-mg-35m2-id-2556713136/,Classe A imoveis,2556713136,['APARTMENT']
1700.0,80.0,30.0,2,1,0,0.0,"Rua Maria de Lourdes Carreira, São João Batista, Minas Gerais",Aluguel Residential / Kitnet Belo Horizonte MG,/imovel/aluguel-quitinete-2-quartos-sao-joao-batista-belo-horizonte-mg-30m2-id-2558874522/,Marques e Rodrigues Consultoria Imobiliaria,2558874522,['APARTMENT']
600.0,210.0,35.0,1,1,0,52.0,"Rua Contria, Prado, Minas Gerais",Kitinet para alugar no Prado,/imovel/aluguel-quitinete-1-quarto-com-cozinha-prado-belo-horizonte-mg-35m2-id-2558794042/,SAGEL IMOBILIÁRIA LTDA-ME,2558794042,['KITNET']
1400.0,100.0,45.0,1,1,0,100.0,"Prado, Minas Gerais","Kitnet com 1 dormitório para alugar, 45 m² por R$ 1.400,00/mês - Prado - Belo Horizonte/MG",/imovel/aluguel-quitinete-1-quarto-com-interfone-prado-belo-horizonte-mg-45m2-id-2556820878/,NORTE SUL IMÓVEIS,2556820878,['APARTMENT']
1154.0,0.0,30.0,1,1,1,22.0,"Rua Barroso Neto, Havaí, Minas Gerais","Casa com 1 quarto e área privativa para alugar, 42 m² por R$ 1.154/mês - Havaí - Belo Horizonte/MG",/imovel/aluguel-quitinete-1-quarto-com-churrasqueira-havai-belo-horizonte-mg-30m2-id-2557941211/,VIA NOBRE ALUGUEL,2557941211,['APARTMENT']
720.0,80.0,30.0,1,1,0,0.0,"Rua Capitão Bragança, Santa Tereza, Minas Gerais",Aluguel - QUITINETE - SANTA TEREZA Belo Horizonte MG,/imovel/aluguel-quitinete-1-quarto-com-interfone-santa-tereza-belo-horizonte-mg-30m2-id-2557919411/,HYLLEGE LIMA IMÓVEIS,2557919411,['KITNET']
550.0,0.0,50.0,1,1,0,7.0,"Rua Medeiros, Minaslandia P Maio, Minas Gerais","Kitnet para aluguel, 1 quarto, Minaslândia (P Maio) - Belo Horizonte/MG",/imovel/aluguel-quitinete-1-quarto-com-cozinha-minaslandia-p-maio-belo-horizonte-mg-50m2-id-2557653071/,Alugamax,2557653071,['KITNET']
720.0,80.0,30.0,1,1,0,0.0,"Rua Capitão Bragança, Santa Tereza, Minas Gerais",Aluguel - QUITINETE - SANTA TEREZA Belo Horizonte MG,/imovel/aluguel-quitinete-1-quarto-com-interfone-santa-tereza-belo-horizonte-mg-30m2-id-2557919412/,HYLLEGE LIMA IMÓVEIS,2557919412,['KITNET']
680.0,10.0,40.0,1,1,0,30.0,"Rua Três Pontas, Carlos Prates, Minas Gerais",Kitinet para alugar no Carlos Prates,/imovel/aluguel-quitinete-1-quarto-com-cozinha-carlos-prates-belo-horizonte-mg-40m2-id-2558534868/,SAGEL IMOBILIÁRIA LTDA-ME,2558534868,['KITNET']
750.0,0.0,35.0,1,1,0,0.0,"Rua Bagé, Carlos Prates, Minas Gerais",Kitnet/Conjugado para aluguel com 35 metros quadrados com 1 quarto,/imovel/aluguel-quitinete-1-quarto-carlos-prates-belo-horizonte-mg-35m2-id-2551522901/,Sérgio da Silva Trotta,2551522901,['KITNET']
1200.0,313.0,36.0,1,1,0,69.0,"Rua São Paulo, Centro, Minas Gerais",LOFT - RUA SÃO PAULO - BAIRRO CENTRO PRÓXIMO AO BANCO BRADESCO,/imovel/aluguel-quitinete-1-quarto-centro-belo-horizonte-mg-36m2-id-2462207758/,RACIONAL IMOVEIS E SEGUROS LTDA,2462207758,['APARTMENT']
450.0,0.0,50.0,1,1,0,7.0,"Rua Medeiros, Minaslandia P Maio, Minas Gerais","Kitnet para aluguel, 1 quarto, Minaslândia (P Maio) - Belo Horizonte/MG",/imovel/aluguel-quitinete-1-quarto-com-varanda-minaslandia-p-maio-belo-horizonte-mg-50m2-id-2556838895/,Alugamax,2556838895,['KITNET']
550.0,0.0,50.0,1,1,0,32.0,"Rua Maria das Graças, Maria Goretti, Minas Gerais",Kitnet/conjugado para aluguel no bairro Maria Goretti,/imovel/aluguel-quitinete-1-quarto-maria-goretti-belo-horizonte-mg-50m2-id-2555961609/,Alugamax,2555961609,['APARTMENT']
800.0,80.0,40.0,1,1,0,0.0,"Caiçaras, Minas Gerais",Quitinete para alugar no bairro Cai?ara,/imovel/aluguel-quitinete-1-quarto-com-interfone-caicaras-belo-horizonte-mg-40m2-id-2557437503/,Oportunidades Corretora de Imóveis,2557437503,['APARTMENT']
1050.0,0.0,45.0,1,1,0,0.0,"Floresta, Minas Gerais",BELO HORIZONTE - Kitchenette/Studio - Floresta,/imovel/aluguel-quitinete-1-quarto-floresta-belo-horizonte-mg-45m2-id-2558024560/,Constantino Imóveis Ltda,2558024560,['KITNET']
1700.0,620.0,40.0,0,1,1,1254.0,"Avenida Barão Homem de Melo, Estoril, Minas Gerais",Kitnet para aluguel 1 suíte 1 vaga - Estoril,/imovel/aluguel-quitinete-mobiliado-estoril-belo-horizonte-mg-40m2-id-2558904071/,Luiz Renato Imóveis,2558904071,['KITNET']
700.0,390.0,67.0,1,1,0,110.0,"Avenida Augusto de Lima, Centro, Minas Gerais",EXCELENTE LOCALIZAÇAO,/imovel/aluguel-quitinete-1-quarto-com-acesso-24-horas-centro-belo-horizonte-mg-67m2-id-2557919072/,URBS Administradora Ltda - ME,2557919072,['APARTMENT']
900.0,0.0,35.0,1,1,0,0.0,"Padre Eustáquio, Minas Gerais","Kitnet Mobiliada 1 quarto, 1 banho - Padre Eustáquio",/imovel/aluguel-quitinete-1-quarto-mobiliado-padre-eustaquio-belo-horizonte-mg-35m2-id-2556404240/,Conquiste Imoveis,2556404240,['APARTMENT']
1400.0,0.0,30.0,1,1,0,0.0,"Rua Rodrigues Caldas, Santo Agostinho, Minas Gerais","Augo Kitnet Mobiliada com tudo incluso, tv acabo, internet, agua, luz e iptu.",/imovel/aluguel-quitinete-1-quarto-mobiliado-santo-agostinho-belo-horizonte-mg-30m2-id-67083650/,Welington Carvalhais Barroso,67083650,['KITNET']
700.0,30.0,45.0,1,1,0,50.0,"Rua Hélio de Senna Figueiredo, Serrano, Minas Gerais","Barracão No Bairro Serrano para Locação com Sala, Cozinha, Banho social e área externa",/imovel/aluguel-quitinete-1-quarto-com-infraestrutura-internet-serrano-belo-horizonte-mg-45m2-id-2553455719/,IDEALLY,2553455719,['APARTMENT']
800.0,120.0,40.0,1,1,0,12.0,"Rua Barão de Coromandel, Caiçaras, Minas Gerais",Kitnet com 1 dormitório para alugar em Belo Horizonte,/imovel/aluguel-quitinete-1-quarto-caicaras-belo-horizonte-mg-40m2-id-2557707545/,INOVA PLATAFORMA DE INTEGRACAO,2557707545,['APARTMENT']
650.0,0.0,35.0,1,1,0,33.0,"Rua Hortencia, Esplanada, Minas Gerais",Kitnet/conjugado para aluguel possui 35 metros quadrados com 1 quarto,/imovel/aluguel-quitinete-1-quarto-esplanada-belo-horizonte-mg-35m2-id-2557915080/,Souza e Alves Empreendimentos Imobiliários,2557915080,['APARTMENT']
990.0,0.0,40.0,1,1,0,30.0,"Prado, Minas Gerais",Belo Horizonte - Kitchenette/Conjugados - Prado,/imovel/aluguel-quitinete-1-quarto-prado-belo-horizonte-mg-40m2-id-2557042776/,Prado Imóveis Ltda,2557042776,['KITNET']
600.0,0.0,35.0,1,1,1,50.0,"Santo André, Minas Gerais",Aluguel Residential / Kitnet Belo Horizonte MG,/imovel/aluguel-quitinete-1-quarto-santo-andre-belo-horizonte-mg-35m2-id-2556139620/,Bonsucesso Corretora e Administradora de Imóveis,2556139620,['APARTMENT']
990.0,0.0,40.0,1,1,0,30.0,"Prado, Minas Gerais",Belo Horizonte - Kitchenette/Conjugados - Prado,/imovel/aluguel-quitinete-1-quarto-prado-belo-horizonte-mg-40m2-id-2557043547/,Prado Imóveis Ltda,2557043547,['KITNET']
600.0,0.0,40.0,1,1,0,0.0,"Rua Candelária, Vila Oeste, Minas Gerais",Belo Horizonte - Kitchenette/Conjugados - Vila Oeste,/imovel/aluguel-quitinete-1-quarto-vila-oeste-belo-horizonte-mg-40m2-id-2538060163/,Universal Imoveis,2538060163,['KITNET']
1150.0,281.0,30.0,1,1,0,45.0,"Rua São Paulo, Centro, Minas Gerais","Kitnet para aluguel, 1 quarto, Centro - Belo Horizonte/MG",/imovel/aluguel-quitinete-1-quarto-mobiliado-centro-belo-horizonte-mg-30m2-id-2556500914/,Utilbrás Imóveis - Aluguel,2556500914,['KITNET']
680.0,10.0,45.0,1,1,0,30.0,"Rua Três Pontas, Carlos Prates, Minas Gerais",Kitinet para alugar no Carlos Prates,/imovel/aluguel-quitinete-1-quarto-carlos-prates-belo-horizonte-mg-45m2-id-2555967610/,SAGEL IMOBILIÁRIA LTDA-ME,2555967610,['KITNET']
550.0,0.0,50.0,1,1,0,0.0,"Beco Adelina Amaral Pongeluppe, Araguaia, Minas Gerais",Casa - 01 quartos - Flávio Marques / Belo Horizonte,/imovel/aluguel-quitinete-1-quarto-araguaia-belo-horizonte-mg-50m2-id-2550613776/,Adquirir Imoveis,2550613776,['APARTMENT']
590.0,0.0,50.0,1,1,0,0.0,"Rua Doutor Cristiano Rezende, Flávio Marques Lisboa, Minas Gerais",Kitnet em Bonsucesso - Belo Horizonte,/imovel/aluguel-quitinete-1-quarto-flavio-marques-lisboa-belo-horizonte-mg-50m2-id-2555094833/,UP ESTATE IMÓVEIS,2555094833,['APARTMENT']
300.0,0.0,10.0,1,1,0,11.0,"Rua Bueno Brandão, Santa Tereza, Minas Gerais",Aluguel - QUITINETE - SANTA TEREZA Belo Horizonte MG,/imovel/aluguel-quitinete-1-quarto-santa-tereza-belo-horizonte-mg-10m2-id-2553439408/,HYLLEGE LIMA IMÓVEIS,2553439408,['KITNET']
900.0,0.0,18.0,1,1,1,34.0,"Rua Sebastião Antônio Carlos, Bandeirantes, Minas Gerais",Kitnet com 18m² e 1 quarto,/imovel/aluguel-quitinete-1-quarto-bandeirantes-belo-horizonte-mg-18m2-id-2539378378/,LOCKEY,2539378378,['APARTMENT']
1020.0,240.0,19.0,1,1,0,0.0,"Rua Jacutinga, Padre Eustáquio, Minas Gerais","Kitnet - Padre Eustáquio - Belo Horizonte, MG - R$ 850,00",/imovel/aluguel-quitinete-1-quarto-com-cozinha-padre-eustaquio-belo-horizonte-mg-19m2-id-2554909299/,UP ESTATE IMÓVEIS,2554909299,['APARTMENT']
1400.0,0.0,27.0,1,1,0,0.0,"Avenida Álvares Cabral, Lourdes, Minas Gerais","Alugo Kitnet mobiliada no Lourdes com tudo Incluído, IPTU, Água, Luz, Internet, Condominio e Tvaca",/imovel/aluguel-quitinete-1-quarto-mobiliado-lourdes-belo-horizonte-mg-27m2-id-66869069/,Welington Carvalhais Barroso,66869069,['KITNET']
600.0,0.0,40.0,1,1,1,50.0,"Aparecida, Minas Gerais",Aluguel Residential / Kitnet Belo Horizonte MG,/imovel/aluguel-quitinete-1-quarto-aparecida-belo-horizonte-mg-40m2-id-2547065206/,Bonsucesso Corretora e Administradora de Imóveis,2547065206,['APARTMENT']
650.0,0.0,30.0,1,1,0,21.0,"Rua Saí, Concórdia, Minas Gerais","Kitnet para aluguel, 1 quarto, Concórdia - Belo Horizonte/MG",/imovel/aluguel-quitinete-1-quarto-com-cozinha-concordia-belo-horizonte-mg-30m2-id-2541659139/,JUNCALL ADMINISTRADORA DE IMOVEIS LTDA - ME,2541659139,['KITNET']
500.0,0.0,35.0,1,1,0,0.0,"Lagoa, Minas Gerais",Belo Horizonte - Kitchenette/Conjugados - Lagoa,/imovel/aluguel-quitinete-1-quarto-lagoa-belo-horizonte-mg-35m2-id-2558269544/,Ac Souza Imóveis Ltda - Me,2558269544,['KITNET']
650.0,0.0,50.0,1,1,0,60.0,"São João Batista, Minas Gerais","Kitinet, São João Batista!",/imovel/aluguel-quitinete-1-quarto-sao-joao-batista-belo-horizonte-mg-50m2-id-2558651127/,Empreendimentos Imobiliários Daniel Martins Ltda-ME,2558651127,['APARTMENT']
680.0,10.0,45.0,1,1,0,30.0,"Rua Três Pontas, Carlos Prates, Minas Gerais",Kitinet para alugar no Carlos Prates,/imovel/aluguel-quitinete-1-quarto-carlos-prates-belo-horizonte-mg-45m2-id-2554177526/,SAGEL IMOBILIÁRIA LTDA-ME,2554177526,['KITNET']
500.0,0.0,30.0,1,1,0,50.0,"Rua Santa Rita do Itueto, Jardim Leblon, Minas Gerais",LOCAÇÃO KITNET 01 QUARTO - JARDIM LEBLON,/imovel/aluguel-quitinete-1-quarto-jardim-leblon-belo-horizonte-mg-30m2-id-82266371/,Usa União de Serviços e Administração Ltda-ME,82266371,['KITNET']
650.0,0.0,35.0,1,1,0,15.0,"Rua Hortencia, Esplanada, Minas Gerais",Kitnet/conjugado para aluguel tem 35 metros quadrados com 1 quarto,/imovel/aluguel-quitinete-1-quarto-esplanada-belo-horizonte-mg-35m2-id-2554919156/,Souza e Alves Empreendimentos Imobiliários,2554919156,['APARTMENT']
1000.0,80.0,19.0,1,1,0,0.0,"São João Batista, Minas Gerais",Kitnet/conjugado para aluguel com 19 metros quadrados com 1 quarto,/imovel/aluguel-quitinete-1-quarto-mobiliado-sao-joao-batista-belo-horizonte-mg-19m2-id-2529201309/,ALFREDO MARQUES CONSULTOR IMOBILIÁRIO,2529201309,['APARTMENT']
550.0,0.0,50.0,1,1,0,0.0,"Rua Doutor Cristiano Rezende, Flavio Marques Lisboa Barreiro, Minas Gerais",Kitnet em Flávio Marques Lisboa (Barreiro) - Belo Horizonte,/imovel/aluguel-quitinete-1-quarto-flavio-marques-lisboa-barreiro-belo-horizonte-mg-50m2-id-2555094834/,UP ESTATE IMÓVEIS,2555094834,['APARTMENT']
695.0,0.0,27.0,2,1,0,0.0,"Rua Póvoa de Varzim, Paquetá, Minas Gerais",Alugo kitinete,/imovel/aluguel-quitinete-2-quartos-paqueta-belo-horizonte-mg-27m2-id-2498348677/,Pedro Ferreira,2498348677,['APARTMENT']
650.0,0.0,30.0,1,1,0,21.0,"Rua Saí, Concórdia, Minas Gerais","Kitnet para aluguel, 1 quarto, Concórdia - Belo Horizonte/MG",/imovel/aluguel-quitinete-1-quarto-com-cozinha-concordia-belo-horizonte-mg-30m2-id-2541834798/,JUNCALL ADMINISTRADORA DE IMOVEIS LTDA - ME,2541834798,['KITNET']
650.0,60.0,35.0,1,1,0,28.0,"Caiçaras, Minas Gerais",Quitinete para alugar no bairro Cai?ara,/imovel/aluguel-quitinete-1-quarto-com-interfone-caicaras-belo-horizonte-mg-35m2-id-2554159048/,Oportunidades Corretora de Imóveis,2554159048,['APARTMENT']
600.0,0.0,40.0,1,1,0,40.0,"Cachoeirinha, Minas Gerais","Kitnet com 1 dormitório para alugar, 40 m² por R$ 600,00/mês - Cachoeirinha - Belo Horizonte/MG",/imovel/aluguel-quitinete-1-quarto-com-cozinha-cachoeirinha-belo-horizonte-mg-40m2-id-2527034397/,IMOBILIÁRIA TEMPONI,2527034397,['APARTMENT']
1300.0,80.0,28.0,1,1,0,0.0,"Rua Maria de Lourdes Carreira, São João Batista, Minas Gerais","Kitnet com 1 Quarto e 1 banheiro para Alugar, 28 m? por R$ 1.300/M?s",/imovel/aluguel-quitinete-1-quarto-sao-joao-batista-belo-horizonte-mg-28m2-id-2524108040/,Marques e Rodrigues Consultoria Imobiliaria,2524108040,['APARTMENT']
750.0,0.0,25.0,1,1,0,0.0,"Rua da Estrada, Goiânia, Minas Gerais","Kitnet - Goiânia - Belo Horizonte - R$ 750,00",/imovel/aluguel-quitinete-1-quarto-goiania-belo-horizonte-mg-25m2-id-2550057262/,UP ESTATE IMÓVEIS,2550057262,['APARTMENT']
500.0,0.0,35.0,1,1,0,0.0,"Lagoa, Minas Gerais",Belo Horizonte - Kitchenette/Conjugados - Lagoa,/imovel/aluguel-quitinete-1-quarto-lagoa-belo-horizonte-mg-35m2-id-2558269543/,Ac Souza Imóveis Ltda - Me,2558269543,['KITNET']
500.0,0.0,30.0,1,1,0,44.0,"Rua Genebra, Nova Suíssa, Minas Gerais",Barracão de 01 dormitório - Nova Suiça,/imovel/aluguel-quitinete-1-quarto-com-cozinha-nova-suissa-belo-horizonte-mg-30m2-id-1042251079/,RS ADMINISTRADORA DE IMOVEIS,1042251079,['KITNET']
560.0,0.0,27.0,1,1,1,0.0,"Nova Gameleira, Minas Gerais","Kitnet para Locação em Belo Horizonte, Nova Gameleira, 1 dormitório, 1 suíte, 1 banheiro, 1 vaga",/imovel/aluguel-quitinete-1-quarto-nova-gameleira-belo-horizonte-mg-27m2-id-2557415792/,Publikar Imóveis Ltda,2557415792,['APARTMENT']
550.0,0.0,47.0,1,1,0,42.0,"Rua Aveiro, São Francisco, Minas Gerais",Kitnet/conjugado para aluguel com 47 metros quadrados com 1 quarto,/imovel/aluguel-quitinete-1-quarto-com-area-de-servico-sao-francisco-belo-horizonte-mg-47m2-id-2532715804/,RMG IMOVEIS LTDA ME,2532715804,['APARTMENT']
1200.0,0.0,23.0,1,1,0,0.0,"Esplanada, Minas Gerais","Kitnet com 1 dormitório para alugar, 23 m² por R$ 1.200,00/mês - Esplanada - Belo Horizonte/MG",/imovel/aluguel-quitinete-1-quarto-com-cozinha-esplanada-belo-horizonte-mg-23m2-id-2555300521/,Renato Desidério Negócios Imobiliários Ltda,2555300521,['APARTMENT']
1200.0,0.0,23.0,1,1,0,0.0,"Esplanada, Minas Gerais","Kitnet com 1 dormitório para alugar, 23 m² por R$ 1.200,00/mês - Esplanada - Belo Horizonte/MG",/imovel/aluguel-quitinete-1-quarto-com-cozinha-esplanada-belo-horizonte-mg-23m2-id-2555300522/,Renato Desidério Negócios Imobiliários Ltda,2555300522,['APARTMENT']
550.0,0.0,30.0,1,1,0,0.0,"Aparecida, Minas Gerais",Aluguel Residential / Kitnet Belo Horizonte MG,/imovel/aluguel-quitinete-1-quarto-aparecida-belo-horizonte-mg-30m2-id-2558600653/,Bonsucesso Corretora e Administradora de Imóveis,2558600653,['APARTMENT']
1100.0,80.0,20.0,1,1,0,0.0,"São João Batista, Minas Gerais",Kitnet/conjugado para aluguel com 20 metros quadrados com 1 quarto,/imovel/aluguel-quitinete-1-quarto-mobiliado-sao-joao-batista-belo-horizonte-mg-20m2-id-2529199583/,ALFREDO MARQUES CONSULTOR IMOBILIÁRIO,2529199583,['APARTMENT']
800.0,0.0,24.0,1,1,1,0.0,"Rua Conde Ribeiro do Vale, Sagrada Família, Minas Gerais","Kitnet com 1 dormitório para alugar, 24 m² por R$ 800,00/mês - Sagrada Família - Belo Horizonte/MG",/imovel/aluguel-quitinete-1-quarto-com-cozinha-sagrada-familia-belo-horizonte-mg-24m2-id-2539433308/,Dominus Imóveis,2539433308,['APARTMENT']
550.0,0.0,30.0,1,1,0,0.0,"Renascença, Minas Gerais",KITNET BAIRRO RENASCENÇA,/imovel/aluguel-quitinete-1-quarto-renascenca-belo-horizonte-mg-30m2-id-2548587982/,IMOBILIÁRIA TEMPONI,2548587982,['APARTMENT']
600.0,60.0,30.0,1,1,0,28.0,"Caiçaras, Minas Gerais",Quitinete para alugar no bairro Cai?ara,/imovel/aluguel-quitinete-1-quarto-com-interfone-caicaras-belo-horizonte-mg-30m2-id-2558601227/,Oportunidades Corretora de Imóveis,2558601227,['APARTMENT']
500.0,0.0,35.0,1,1,0,67.0,"Caiçara Adeláide, Minas Gerais",Quitinete para alugar no bairro Cai?ara,/imovel/aluguel-quitinete-1-quarto-caicara-adelaide-belo-horizonte-mg-35m2-id-2536664487/,Oportunidades Corretora de Imóveis,2536664487,['APARTMENT']
1200.0,100.0,45.0,1,1,0,1200.0,"Prado, Minas Gerais",kitnet 45m² - Bairro Prado,/imovel/aluguel-quitinete-1-quarto-prado-belo-horizonte-mg-45m2-id-2529810092/,Conquiste Imoveis,2529810092,['APARTMENT']
510.0,0.0,25.0,1,1,0,0.0,"Rua Heitor Silva, Rio Branco, Minas Gerais",Belo Horizonte - Kitchenette/Conjugados - Rio Branco,/imovel/aluguel-quitinete-1-quarto-rio-branco-belo-horizonte-mg-25m2-id-2487301681/,VENDA NOVA IMOVEIS EIRELLI ME,2487301681,['KITNET']
650.0,0.0,30.0,1,1,0,0.0,"Avenida Jequitinhonha, Vera Cruz, Minas Gerais",Kitnet com 30m² e 1 quarto,/imovel/aluguel-quitinete-1-quarto-com-area-de-servico-vera-cruz-belo-horizonte-mg-30m2-id-2545513505/,LOCKEY,2545513505,['APARTMENT']
950.0,250.0,20.0,1,1,0,120.0,"Rua dos Timbiras, Santo Agostinho, Minas Gerais","ALUGO KIT NET MOBILIADA NO JK, PRÓXIMO AO SHOPPING.",/imovel/aluguel-quitinete-1-quarto-mobiliado-santo-agostinho-belo-horizonte-mg-20m2-id-2487101881/,Welington Carvalhais Barroso,2487101881,['KITNET']
600.0,0.0,40.0,1,1,0,24.0,"São Paulo, Minas Gerais",Aluguel Residential / Kitnet Belo Horizonte MG,/imovel/aluguel-quitinete-1-quarto-sao-paulo-belo-horizonte-mg-40m2-id-2520576148/,A V IMOVEIS ALUGUEL E VENDA,2520576148,['KITNET']
600.0,60.0,35.0,1,1,0,28.0,"Caiçaras, Minas Gerais",Quitinete para alugar no bairro Cai?ara,/imovel/aluguel-quitinete-1-quarto-com-interfone-caicaras-belo-horizonte-mg-35m2-id-2553020816/,Oportunidades Corretora de Imóveis,2553020816,['APARTMENT']
1200.0,0.0,23.0,1,1,0,0.0,"Esplanada, Minas Gerais","Kitnet com 1 dormitório para alugar, 23 m² por R$ 1.200,00/mês - Esplanada - Belo Horizonte/MG",/imovel/aluguel-quitinete-1-quarto-esplanada-belo-horizonte-mg-23m2-id-2555300714/,Renato Desidério Negócios Imobiliários Ltda,2555300714,['APARTMENT']
750.0,0.0,15.0,1,1,0,45.0,"Rua Professor Raimundo Nonato, Santa Tereza, Minas Gerais",Belo Horizonte - Kitchenette/Conjugados - Santa Tereza,/imovel/aluguel-quitinete-1-quarto-santa-tereza-belo-horizonte-mg-15m2-id-2552945325/,Minas Lar Corretora de Imóveis Ltda ME,2552945325,['KITNET']
390.0,0.0,40.0,1,1,0,51.0,"Rua Itapeva, Concórdia, Minas Gerais",Aluguel - QUITINETE - CONCORDIA Belo Horizonte MG,/imovel/aluguel-quitinete-1-quarto-concordia-belo-horizonte-mg-40m2-id-2526820590/,HYLLEGE LIMA IMÓVEIS,2526820590,['KITNET']
1100.0,80.0,20.0,1,1,0,0.0,"Rua Maria de Lourdes Carreira, São João Batista, Minas Gerais","Kitnet com 1 Quarto e 1 banheiro para Alugar, 20 m?",/imovel/aluguel-quitinete-1-quarto-sao-joao-batista-belo-horizonte-mg-20m2-id-2524110517/,Marques e Rodrigues Consultoria Imobiliaria,2524110517,['APARTMENT']
850.0,150.0,30.0,1,1,0,28.0,"Padre Eustáquio, Minas Gerais",BELO HORIZONTE - Kitchenette/Studio - Padre Eustáquio,/imovel/aluguel-quitinete-1-quarto-com-area-de-servico-padre-eustaquio-belo-horizonte-mg-30m2-id-2521987485/,A-SIIM Imóveis Imobiliária Ltda - ME,2521987485,['KITNET']
1200.0,80.0,26.0,1,1,0,0.0,"Rua Maria de Lourdes Carreira, São João Batista, Minas Gerais","Kitnet com 1 Quarto e 1 banheiro para Alugar, 26 m? por R$ 1.200/M?s",/imovel/aluguel-quitinete-1-quarto-sao-joao-batista-belo-horizonte-mg-26m2-id-2524108039/,Marques e Rodrigues Consultoria Imobiliaria,2524108039,['APARTMENT']
400.0,0.0,10.0,1,1,0,0.0,"Rua Zélio Murta, Dom Bosco, Minas Gerais",BELO HORIZONTE - Kitchenette/Conjugados - Dom Bosco,/imovel/aluguel-quitinete-1-quarto-dom-bosco-belo-horizonte-mg-10m2-id-2520818432/,ARIANE IMÓVEIS 35 ANOS,2520818432,['KITNET']
1000.0,80.0,19.0,1,1,0,0.0,"Rua Maria de Lourdes Carreira, São João Batista, Minas Gerais","Kitnet com 1 Quarto e 1 banheiro para Alugar, 19 m?",/imovel/aluguel-quitinete-1-quarto-sao-joao-batista-belo-horizonte-mg-19m2-id-2524108038/,Marques e Rodrigues Consultoria Imobiliaria,2524108038,['APARTMENT']
